{"abi":"c11","artifact_kind":"dynamic-library","backend_config":null,"build_system":"rustc-clang","consumer":{"language":"c","runtime":"native"},"defaults":{"origin":{"authority":"profile-default","id":"native-values.copy","location":{"column":1,"line":1,"path":"profile.json"}},"values":{"ownership":"copy"}},"deployment_target":"14.0","direction":"consumer-to-provider","id":"i01-native-values-macos-arm64-0-1-1","macros":[],"provider":{"language":"rust","runtime":"native"},"required_features":["core.exact-numbers@1","core.values@1"],"restrictions":[],"route":"RUST-C-ABI","schema":"madb.profile/1","sdk":{"path":"toolchain.json","schema":"madb.native-toolchain/1","sha256":"sha256:e487a9fe5975b3e8d4e9af4e89b1915c7054ce74ccc1293706a3621034ed6bd4","size":20795},"supported_features":["core.exact-numbers@1","core.values@1"],"target":"aarch64-apple-darwin","tools":[{"arguments":[],"host":"aarch64-apple-darwin","id":"c05-ar","sha256":"sha256:85d15bd3999895f659e8a483b17ea9ab44b924c8e0b3026abfe359f2de02cbd7","source":"system://observed-native-toolchain/ar","target":"aarch64-apple-darwin","version":"Apple clang version 21.0.0 (clang-2100.3.34.2)"},{"arguments":[],"host":"aarch64-apple-darwin","id":"c05-bindgen","sha256":"sha256:026f84aac049a49af885d9069ea04ebf8c0002a6d6ae17cc4e6bc6186588851d","source":"system://observed-native-toolchain/bindgen","target":"aarch64-apple-darwin","version":"0.73.2"},{"arguments":[],"host":"aarch64-apple-darwin","id":"c05-cbindgen","sha256":"sha256:28e4fa35fb22ccbd0cd9e5ad0f640d62644a0fce5666e8b1f246e336a63d9880","source":"system://observed-native-toolchain/cbindgen","target":"aarch64-apple-darwin","version":"0.29.4"},{"arguments":[],"host":"aarch64-apple-darwin","id":"c05-clang","sha256":"sha256:1590ac950a3d627817d09ade5cb60b2115f17a72182a3141e010b4bcc482a0c9","source":"system://observed-native-toolchain/clang","target":"aarch64-apple-darwin","version":"Apple clang version 21.0.0 (clang-2100.3.34.2)"},{"arguments":[],"host":"aarch64-apple-darwin","id":"c05-finalizer","sha256":"sha256:f8030ec840a5bb3570eaf7008e4cbf2f399c352f2a00e10113879efdde3dbd6a","source":"system://observed-native-toolchain/finalizer","target":"aarch64-apple-darwin","version":"0.1.0"},{"arguments":[],"host":"aarch64-apple-darwin","id":"c05-libclang","sha256":"sha256:b206adf7f1c2b3f466f5ae24acb6fa787e1872981083f28d3e691c8e23830c2a","source":"system://observed-native-toolchain/libclang","target":"aarch64-apple-darwin","version":"Apple clang version 21.0.0 (clang-2100.3.34.2)"},{"arguments":[],"host":"aarch64-apple-darwin","id":"c05-nm","sha256":"sha256:82e9189ec1a359699d4b680601c0a2930a9cbea7376c7320947dff5e9862cfa8","source":"system://observed-native-toolchain/nm","target":"aarch64-apple-darwin","version":"Apple clang version 21.0.0 (clang-2100.3.34.2)"},{"arguments":[],"host":"aarch64-apple-darwin","id":"c05-python","sha256":"sha256:02a8df1726463faedb3adef289b3d1bdeabb7785c837fd8c174023aeeeb4d312","source":"system://observed-native-toolchain/python","target":"aarch64-apple-darwin","version":"3.14.4"},{"arguments":[],"host":"aarch64-apple-darwin","id":"c05-rustc","sha256":"sha256:1ba7bb8e273bd64125f4048d2ecce530e0a6470e565ab1b3aecf0b82b532f7b1","source":"system://observed-native-toolchain/rustc","target":"aarch64-apple-darwin","version":"1.99.1"},{"arguments":[],"host":"aarch64-apple-darwin","id":"madb-native-values-read","sha256":"sha256:afbfd9ef18c5a65d0f4d990c8184902c273b801081fa7ac0e5c0ee975afe615e","source":"system://observed-native-toolchain/values_reader","target":"aarch64-apple-darwin","version":"0.1.0"}]}
